Event,Description,Multiplier
Major Exchange Listing,"The cryptocurrency becomes available on a leading centralized exchange like Binance or Coinbase. These platforms have massive user bases, so listing increases access and often drives price surges due to increased demand.",1.25
Security Breach,"A vulnerability is discovered in the smart contract or wallet infrastructure, allowing attackers to steal funds. Such breaches undermine trust in the project and often lead to panic selling.",0.65
Strategic Corporate Partnership,"The project announces a collaboration with a major tech or financial company, which adds credibility and potential real-world use cases for the token.",1.3
Government Ban,"A major economy (e.g., the U.S. or China) announces a ban on the cryptocurrency’s use, trading, or mining. Regulatory restrictions from influential nations can significantly damage market sentiment.",0.6
Mainnet Launch,The project transitions from a test environment (testnet) to its fully operational blockchain (mainnet). This milestone often indicates the project is maturing and increasing its utility.,1.2
Rug Pull Allegations,"Allegations arise that the development team is planning an exit scam, where they abandon the project after extracting investor funds. This severely impacts investor confidence.",0.5
Celebrity Endorsement,A well-known celebrity or influencer publicly supports or invests in the project. This can lead to a spike in popularity and a temporary price rally.,1.15
Stablecoin Depeg Incident,A stablecoin integral to the crypto ecosystem loses its peg to the US dollar. Such instability can shake investor trust and reduce overall liquidity.,0.75
Token Burn Event,The team permanently removes a portion of tokens from circulation to reduce supply. Basic supply-and-demand principles mean this can increase the price of remaining tokens.,1.1
Key Team Member Resignation,"A prominent developer or executive leaves the project, raising concerns about internal stability and leadership continuity.",0.8
DAO Governance Upgrade,A decentralized autonomous organization (DAO) vote leads to an improvement in governance mechanisms. This can bolster user confidence and signal community engagement.,1.18
Delayed Roadmap Milestone,"Planned features or updates are delayed, causing frustration among holders and doubts about the team's ability to deliver.",0.85
Legal Victory,The project wins a court case that could have otherwise stifled its operations. This strengthens its legal position and often boosts investor optimism.,1.22
Whale Sell-Off,"A large holder, or 'whale,' sells a significant number of tokens, triggering a sharp decline in price due to market imbalance.",0.7
Major dApp Hack,A widely used decentralized app (dApp) in the ecosystem is hacked. This raises concerns about the entire ecosystem's security.,0.78
Increase in Staking Rewards,"The project raises the rewards for staking, which incentivizes users to lock up tokens and reduces circulating supply.",1.12
Environmental Criticism,"A report criticizes the project's energy consumption, drawing negative attention from environmentally conscious investors and regulators.",0.88
Cross-chain Integration,"The cryptocurrency becomes compatible with other major blockchains (e.g., Ethereum, Solana), enabling broader use cases and attracting more developers.",1.17
Fork Controversy,Disagreements within the community lead to a contentious hard fork proposal. This can create uncertainty and divide the user base.,0.82
Airdrop Announcement,"The team announces a free token distribution (airdrop) for current holders, which can attract new investors and reward loyal users.",1.14
Tokenomics Redesign,"The project announces a change in tokenomics (""how tokens are distributed and used"") which may better incentivize holders and developers.",1.16
Exchange Delisting,"The token is removed from a major exchange, reducing liquidity and accessibility. This can signal declining trust or compliance issues.",0.68
Inflation Bug Discovery,"A flaw is found that could allow the creation of unlimited tokens, threatening the integrity of the currency's supply.",0.55
New Whitepaper Release,"An updated whitepaper is released, showing refined vision and strategy. This can reinvigorate investor interest.",1.09
NFT Integration,"The token is integrated into a new NFT ecosystem or marketplace, opening up fresh use cases and attracting new communities.",1.13
Influencer Scandal,"A key promoter of the crypto is involved in a public scandal, damaging its image and investor confidence.",0.73
Massive On-Chain Activity Spike,"Sudden increase in transactions, wallet creations, or smart contract calls may signal growing adoption and interest.",1.2
Negative Media Coverage,"Mainstream media outlets publish unfavorable articles about the token or team, which can sway public perception.",0.76
Stablecoin Launch,"The project launches its own stablecoin, adding utility and potentially anchoring its ecosystem's value.",1.19
Protocol Governance Attack,"An attacker manipulates voting systems to make unauthorized changes, raising security concerns.",0.6
Integration with Payment Platforms,"The crypto is added to major payment platforms like PayPal or Visa, greatly enhancing its real-world usability.",1.28
Token Migration,"The token migrates from one blockchain to another, such as from Ethereum to its own chain. This can improve scalability or reduce fees.",1.11
Major Validator Goes Offline,"A large validator node shuts down unexpectedly, impacting network security or uptime.",0.77
AI Integration,"The project integrates AI features, attracting attention due to AI's growing popularity and perceived innovation.",1.21
Decentralized ID (DID) Feature Launch,"New identity verification tools based on blockchain are introduced, increasing trust and use in DeFi and beyond.",1.18
Token Tax Controversy,"Authorities propose new tax rules targeting this crypto, causing investor hesitation and possible sell-offs.",0.79
TVL (Total Value Locked) Surge,"The total value locked in the project's DeFi protocols jumps significantly, indicating growing trust and usage.",1.23
Gas Fee Spike,"Transaction fees rise sharply due to congestion or inefficiency, making the network less appealing to use.",0.81
Launch of Layer 2 Solution,"The project rolls out a Layer 2 scaling solution to reduce congestion and fees, which can drive user adoption.",1.26
DeFi Exploit in Ecosystem,"A DeFi protocol using this token is exploited, leading to significant losses and tarnishing ecosystem reputation.",0.66
Mobile App Release,"A mobile wallet or app is launched, making it easier for everyday users to interact with the ecosystem.",1.1
Treasury Diversification,"The project diversifies its treasury into stablecoins or other assets, signaling sound financial management.",1.08
Community Grant Program,"The team launches a grant program to fund developer projects, fostering ecosystem growth.",1.15
Rebranding Announcement,"The project announces a rebrand, aiming to refresh its image and reach new audiences.",1.07
Critical Bug Fix,"A major flaw is patched swiftly, restoring confidence in the development team's competence.",1.06
Exchange Freezes Withdrawals,"A top exchange halts withdrawals of the token due to technical or legal issues, causing panic.",0.7
VC Dumping Tokens,"Early venture capital investors begin liquidating their token holdings, increasing downward price pressure.",0.74
Zero Knowledge Proof Integration,"The project integrates zero-knowledge technology, improving privacy and scalability.",1.2
Roadmap Completion Announcement,"The team announces the completion of all roadmap milestones ahead of schedule, boosting investor optimism.",1.24
Token Becomes Deflationary,"The protocol shifts to a deflationary model, where more tokens are burned than minted, increasing scarcity.",1.27
